{
  "schema": "peps.course_release_receipt",
  "schema_version": 1,
  "release_id": "peps-course-2026-07-22",
  "generated_at_utc": "2026-07-22T02:59:12.885108+00:00",
  "status": "course-ready-paper-exact-blocked",
  "paper_comparable_results": 0,
  "manifest": "results/manifest.json",
  "checklist": "course/RELEASE_CHECKLIST.md",
  "promoted_evidence": [
    {
      "id": "course-fast-image-smoke",
      "status": "validated-course-smoke-not-paper-comparable",
      "paper_comparable": false,
      "claim_scope": "Synthetic image execution-path smoke only; no Kodak or paper-quality claim.",
      "files": [
        {
          "role": "run_manifest",
          "path": "results/runs/20260721T175053994434Z-smoke-image-course_fast-s0-3cfadfa6/manifest.json"
        },
        {
          "role": "raw_rows",
          "path": "results/runs/20260721T175053994434Z-smoke-image-course_fast-s0-3cfadfa6/instances.csv"
        },
        {
          "role": "summary",
          "path": "results/runs/20260721T175053994434Z-smoke-image-course_fast-s0-3cfadfa6/summary.json"
        }
      ],
      "validation": {
        "run_id": "20260721T175053994434Z-smoke-image-course_fast-s0-3cfadfa6",
        "profile": "course_fast",
        "manifest_schema": "peps.run_manifest/v1",
        "raw_row_count": 9,
        "all_rows_status_ok": true,
        "verification_status": "course_fast_smoke_not_paper_comparable"
      }
    },
    {
      "id": "course-fast-texture-smoke",
      "status": "validated-course-smoke-not-paper-comparable",
      "paper_comparable": false,
      "claim_scope": "Synthetic texture execution-path smoke only; no native-4K Table 2 claim.",
      "files": [
        {
          "role": "run_manifest",
          "path": "results/runs/20260721T175141764666Z-smoke-texture-course_fast-s0-737949da/manifest.json"
        },
        {
          "role": "raw_rows",
          "path": "results/runs/20260721T175141764666Z-smoke-texture-course_fast-s0-737949da/instances.csv"
        },
        {
          "role": "summary",
          "path": "results/runs/20260721T175141764666Z-smoke-texture-course_fast-s0-737949da/summary.json"
        }
      ],
      "validation": {
        "run_id": "20260721T175141764666Z-smoke-texture-course_fast-s0-737949da",
        "profile": "course_fast",
        "manifest_schema": "peps.run_manifest/v1",
        "raw_row_count": 15,
        "all_rows_status_ok": true,
        "verification_status": "course_fast_smoke_not_paper_comparable"
      }
    },
    {
      "id": "course-fast-sdf-smoke",
      "status": "validated-course-smoke-not-paper-comparable",
      "paper_comparable": false,
      "claim_scope": "Synthetic SDF execution-path smoke only; no 512-cubed paper-table claim.",
      "files": [
        {
          "role": "run_manifest",
          "path": "results/runs/20260721T175154356740Z-smoke-sdf-course_fast-s0-d66561b7/manifest.json"
        },
        {
          "role": "raw_rows",
          "path": "results/runs/20260721T175154356740Z-smoke-sdf-course_fast-s0-d66561b7/instances.csv"
        },
        {
          "role": "summary",
          "path": "results/runs/20260721T175154356740Z-smoke-sdf-course_fast-s0-d66561b7/summary.json"
        }
      ],
      "validation": {
        "run_id": "20260721T175154356740Z-smoke-sdf-course_fast-s0-d66561b7",
        "profile": "course_fast",
        "manifest_schema": "peps.run_manifest/v1",
        "raw_row_count": 5,
        "all_rows_status_ok": true,
        "verification_status": "course_fast_smoke_not_paper_comparable"
      }
    },
    {
      "id": "kodak-convergence-pilot",
      "status": "validated-inconclusive-pilot-not-paper-comparable",
      "paper_comparable": false,
      "claim_scope": "Three-image, two-seed local budget calibration; no Table 1 budget or numeric reproduction was established.",
      "files": [
        {
          "role": "receipt",
          "path": "results/image_convergence/receipt.json"
        },
        {
          "role": "raw_curves",
          "path": "results/image_convergence/curves.csv"
        },
        {
          "role": "recovery_incident",
          "path": "results/image_convergence/external_table1_recovery_incident.json"
        }
      ],
      "validation": {
        "jobs": "18/18",
        "optimizer_steps": "540000/540000",
        "curve_points": "90/90",
        "active_workers": 0,
        "integrity_valid": true,
        "outcome": "inconclusive",
        "recommended_budget_steps": null,
        "verified_table1": false,
        "external_recovery_process_groups_stopped": 8,
        "table1_accounted_optimizer_steps_legacy_unverified": 416500
      }
    },
    {
      "id": "texture-convergence-pilot",
      "status": "validated-inconclusive-pilot-not-paper-comparable",
      "paper_comparable": false,
      "claim_scope": "Two-set bounded convergence pilot extended to 5000 steps (30 trajectories, 180 observations) on GPUs 2/3; method ranking is stable across budgets but curves have not plateaued, so no Table 2 budget or numeric reproduction was established.",
      "files": [
        {
          "role": "receipt",
          "path": "results/texture_repro/convergence_pilot.json"
        },
        {
          "role": "raw_observations",
          "path": "results/texture_repro/convergence_pilot_observations.csv"
        },
        {
          "role": "progress",
          "path": "results/texture_repro/convergence_pilot_progress.json"
        },
        {
          "role": "recovery",
          "path": "results/texture_repro/convergence_pilot_recovery.json"
        }
      ],
      "validation": {
        "trajectories": "30/30",
        "optimizer_steps": "150000/150000",
        "observations": "180/180",
        "active_workers": 0,
        "outcome": "inconclusive_bounded_pilot",
        "recommended_budget_steps": null,
        "full_71m_step_run_authorized": false
      }
    },
    {
      "id": "sdf-public-512-provenance",
      "status": "validated-input-provenance-not-numeric-result",
      "paper_comparable": false,
      "claim_scope": "Public Lucy, Thai Statue, and Armadillo 512-cubed volume provenance only; Pitted Stonefish remains authorization-blocked.",
      "files": [
        {
          "role": "validation_receipt",
          "path": "results/sdf_repro/volume_validation.json"
        },
        {
          "role": "lucy_provenance",
          "path": "data/provenance/sdf/lucy-512.json"
        },
        {
          "role": "thai_statue_provenance",
          "path": "data/provenance/sdf/thai-statue-512.json"
        },
        {
          "role": "armadillo_provenance",
          "path": "data/provenance/sdf/armadillo-512.json"
        }
      ],
      "validation": {
        "public_assets": 3,
        "checksums_verified": true,
        "schemas_validated": true,
        "stonefish_status": "deferred_auth_required",
        "substitution_used": false
      }
    }
  ],
  "legacy_top_level_csvs": {
    "status": "legacy-unverified",
    "count": 9,
    "files": [
      "delta_ablation.csv",
      "hip_latency.csv",
      "image_repro_instances.csv",
      "image_repro_summary.csv",
      "pink_param_savings.csv",
      "table1_image.csv",
      "table2_texture.csv",
      "table3_sdf.csv",
      "w10_rate_distortion.csv"
    ]
  },
  "sdf_public_provenance": [
    {
      "asset_id": "lucy",
      "status": "checksum_and_provenance_verified",
      "shape": [
        512,
        512,
        512
      ],
      "receipt": "data/provenance/sdf/lucy-512.json",
      "volume_sha256": "cd5e292b78e74a47239d348d7e19e3beb9a9c0e36c9d93e82d8e767e1b241366",
      "known_limit": "The paper states that an unreleased C++/HIP converter was used; Open3D exact triangle distance with ray-parity signs is an auditable reproduction protocol, not a bit-exact implementation of that converter."
    },
    {
      "asset_id": "thai-statue",
      "status": "checksum_and_provenance_verified",
      "shape": [
        512,
        512,
        512
      ],
      "receipt": "data/provenance/sdf/thai-statue-512.json",
      "volume_sha256": "87f64ba60815f49c9e317ba861ebd8648e4dd726817e3d86df4db9aa8ef51240",
      "known_limit": "The paper states that an unreleased C++/HIP converter was used; Open3D exact triangle distance with ray-parity signs is an auditable reproduction protocol, not a bit-exact implementation of that converter."
    },
    {
      "asset_id": "armadillo",
      "status": "checksum_and_provenance_verified",
      "shape": [
        512,
        512,
        512
      ],
      "receipt": "data/provenance/sdf/armadillo-512.json",
      "volume_sha256": "8c925ffbf9243c76fbcb08bd57593025698b0538e0e274e2b5f810b9bd8c6f36",
      "known_limit": "The paper states that an unreleased C++/HIP converter was used; Open3D exact triangle distance with ray-parity signs is an auditable reproduction protocol, not a bit-exact implementation of that converter."
    }
  ],
  "pilot_decisions": {
    "kodak": {
      "status": "inconclusive",
      "recommended_budget_steps": null,
      "paper_comparable": false,
      "full_run_authorized": false,
      "receipt": "results/image_convergence/receipt.json"
    },
    "texture": {
      "status": "inconclusive_bounded_pilot",
      "recommended_budget_steps": null,
      "paper_comparable": false,
      "full_run_authorized": false,
      "receipt": "results/texture_repro/convergence_pilot.json"
    }
  },
  "paper_exact": {
    "ready": false,
    "paper_comparable_results": 0,
    "prerequisite_report": "results/paper_exact_prerequisites.json",
    "blockers": [
      {
        "code": "fig5_dataset_not_reported",
        "scope": "image Figure 5",
        "status": "not_reported",
        "detail": "The paper does not identify the native-4K Figure 5 image suite or image count.",
        "evidence": "results/paper_exact_prerequisites.json"
      },
      {
        "code": "fig5_training_budget_not_reported",